{
  "schema_version": 1,
  "version": "1.24.0-pre.7",
  "binaries": {
    "visualiser": {
      "description": "Launch the interactive meta-directory visualiser",
      "platforms": {
        "darwin-arm64": {
          "sha256": "1111111111111111111111111111111111111111111111111111111111111111",
          "signature": "untrusted comment: signature from accelerator release key\nRWTexampleSignatureBytesBase64Placeholder0000000000000000000000==\ntrusted comment: visualiser darwin-arm64\nAAAAexampleGlobalSignatureBase64Placeholder000000000000000000==\n"
        },
        "darwin-x64": {
          "sha256": "2222222222222222222222222222222222222222222222222222222222222222",
          "signature": "untrusted comment: signature from accelerator release key\nRWTexampleSignatureBytesBase64Placeholder0000000000000000000000==\ntrusted comment: visualiser darwin-x64\nAAAAexampleGlobalSignatureBase64Placeholder000000000000000000==\n"
        },
        "linux-arm64": {
          "sha256": "3333333333333333333333333333333333333333333333333333333333333333",
          "signature": "untrusted comment: signature from accelerator release key\nRWTexampleSignatureBytesBase64Placeholder0000000000000000000000==\ntrusted comment: visualiser linux-arm64\nAAAAexampleGlobalSignatureBase64Placeholder000000000000000000==\n"
        },
        "linux-x64": {
          "sha256": "4444444444444444444444444444444444444444444444444444444444444444",
          "signature": "untrusted comment: signature from accelerator release key\nRWTexampleSignatureBytesBase64Placeholder0000000000000000000000==\ntrusted comment: visualiser linux-x64\nAAAAexampleGlobalSignatureBase64Placeholder000000000000000000==\n"
        }
      }
    }
  },
  "artifacts": {
    "browser": {
      "description": "Vendored chromium-headless-shell browser tree",
      "platforms": {
        "darwin-arm64": {
          "sha256": "bffff4f146c7b164256cf632bc20002a2fca9c79d8e7d319dbf1e4cb9e2a0f31",
          "signature": "untrusted comment: signature from accelerator release key\nRWTexampleSignatureBytesBase64Placeholder0000000000000000000000==\ntrusted comment: timestamp:0\tfile:accelerator-browser-darwin-arm64.tar.gz\thashed\nAAAAexampleGlobalSignatureBase64Placeholder000000000000000000==\n",
          "archive_size": 62914560,
          "uncompressed_size": 185790464,
          "entry_count": 14
        },
        "darwin-x64": {
          "sha256": "1ff236eb6a38ca1378806d50e74aa6cba723f21fe570a1a1cf6982437bb4a435",
          "signature": "untrusted comment: signature from accelerator release key\nRWTexampleSignatureBytesBase64Placeholder0000000000000000000000==\ntrusted comment: timestamp:0\tfile:accelerator-browser-darwin-x64.tar.gz\thashed\nAAAAexampleGlobalSignatureBase64Placeholder000000000000000000==\n",
          "archive_size": 62914560,
          "uncompressed_size": 185790464,
          "entry_count": 14
        },
        "linux-arm64": {
          "sha256": "9a168abd0c9545773100661256f6d8100e896f993fb96afdbac017c3b9db606f",
          "signature": "untrusted comment: signature from accelerator release key\nRWTexampleSignatureBytesBase64Placeholder0000000000000000000000==\ntrusted comment: timestamp:0\tfile:accelerator-browser-linux-arm64.tar.gz\thashed\nAAAAexampleGlobalSignatureBase64Placeholder000000000000000000==\n",
          "archive_size": 62914560,
          "uncompressed_size": 185790464,
          "entry_count": 14
        },
        "linux-x64": {
          "sha256": "b50ef6e9a3500e48275ccb8df41323fe8a904d0737c9d2159d6c06559af99262",
          "signature": "untrusted comment: signature from accelerator release key\nRWTexampleSignatureBytesBase64Placeholder0000000000000000000000==\ntrusted comment: timestamp:0\tfile:accelerator-browser-linux-x64.tar.gz\thashed\nAAAAexampleGlobalSignatureBase64Placeholder000000000000000000==\n",
          "archive_size": 62914560,
          "uncompressed_size": 185790464,
          "entry_count": 14
        }
      }
    },
    "driver": {
      "description": "Vendored Node runtime and playwright-core driver bundle",
      "platforms": {
        "darwin-arm64": {
          "sha256": "5f4bfb98e66a4acb4f86f52e47acc31d9ad6e0706bbbda4c2fa7ca8ae7e2cf93",
          "signature": "untrusted comment: signature from accelerator release key\nRWTexampleSignatureBytesBase64Placeholder0000000000000000000000==\ntrusted comment: timestamp:0\tfile:accelerator-driver-darwin-arm64.tar.gz\thashed\nAAAAexampleGlobalSignatureBase64Placeholder000000000000000000==\n",
          "archive_size": 41943040,
          "uncompressed_size": 121634816,
          "entry_count": 492
        },
        "darwin-x64": {
          "sha256": "ab36abbdfe660b799271dea88200f14703ecf40da837dfac2cb7c4d7081a5a0a",
          "signature": "untrusted comment: signature from accelerator release key\nRWTexampleSignatureBytesBase64Placeholder0000000000000000000000==\ntrusted comment: timestamp:0\tfile:accelerator-driver-darwin-x64.tar.gz\thashed\nAAAAexampleGlobalSignatureBase64Placeholder000000000000000000==\n",
          "archive_size": 41943040,
          "uncompressed_size": 121634816,
          "entry_count": 492
        },
        "linux-arm64": {
          "sha256": "dc4ade129a56b368f84fbba635038222091da36c9b76bceb1d456c132e03eab5",
          "signature": "untrusted comment: signature from accelerator release key\nRWTexampleSignatureBytesBase64Placeholder0000000000000000000000==\ntrusted comment: timestamp:0\tfile:accelerator-driver-linux-arm64.tar.gz\thashed\nAAAAexampleGlobalSignatureBase64Placeholder000000000000000000==\n",
          "archive_size": 41943040,
          "uncompressed_size": 121634816,
          "entry_count": 492
        },
        "linux-x64": {
          "sha256": "2ef0e93f1ac0a6f3facff8a6cfdddbb12989ad63c4a7a46dc4bdf616d776e130",
          "signature": "untrusted comment: signature from accelerator release key\nRWTexampleSignatureBytesBase64Placeholder0000000000000000000000==\ntrusted comment: timestamp:0\tfile:accelerator-driver-linux-x64.tar.gz\thashed\nAAAAexampleGlobalSignatureBase64Placeholder000000000000000000==\n",
          "archive_size": 41943040,
          "uncompressed_size": 121634816,
          "entry_count": 492
        }
      }
    }
  }
}
